{
  "policy_id": "house-local-deny-v1",
  "default": "deny",
  "trusted_signing_keys": [
    "trustplane-ed25519-main"
  ],
  "allowed_payload_kinds": [
    "audit",
    "diagnostic",
    "read-only-maintenance"
  ],
  "allowed_target_scopes": [
    "termux-agent",
    "vps-audit"
  ],
  "allow_secret_resolution": false,
  "notes": "Default house policy: deny by default, limited payload kinds, no secret resolution without later elevation."
}
