{
  "policy_id": "house-local-elevated-v1",
  "default": "deny",
  "trusted_signing_keys": [
    "trustplane-ed25519-main"
  ],
  "allowed_payload_kinds": [
    "audit",
    "diagnostic",
    "read-only-maintenance",
    "secret-assisted-audit"
  ],
  "allowed_target_scopes": [
    "termux-agent",
    "vps-audit"
  ],
  "allow_secret_resolution": true,
  "notes": "Elevated local policy for controlled secret-assisted jobs."
}
